{
  "$schema": "../../agent/schemas/token-agent.schema.json",
  "schemaVersion": "2.0.0",
  "kind": "tokens",
  "principles": [
    {
      "id": "principle:semantic-first",
      "summary": "Choose by meaning and context: use documented semantic intents for system meanings, literal color-intent tokens when the hue itself is the intended user- or product-defined identity, and never choose reference-palette tokens directly."
    },
    {
      "id": "principle:compose-families",
      "summary": "Treat backgrounds, foregrounds, borders, interactions, typography primitives, and elevation layers as related recipes rather than isolated visual values."
    },
    {
      "id": "principle:context-before-value",
      "summary": "Choose a token from the surface or product context where it will render; never choose by its current light-theme value."
    },
    {
      "id": "principle:theme-automatic",
      "summary": "Use the same semantic token names in light and dark modes. Switch their mode-aware values with data-theme on the document root (<html>); container attributes do not switch token values, and nested token themes are not supported."
    },
    {
      "id": "principle:meaning-needs-more-than-color",
      "summary": "When a distinction carries status, severity, selection, or other meaning, provide a non-color cue as well."
    }
  ],
  "intents": [
    {
      "id": "intent:neutral",
      "status": "stable",
      "optional": false,
      "summary": "Information or state with no positive, negative, risk, product-identity, or experience-specific meaning.",
      "useWhen": [
        "Showing general information, an unavailable state, or a not-applicable state whose semantic meaning is neutral."
      ],
      "avoidWhen": [
        "The state has a clearer success, risk, failure, brand, guide, AI, or reserved product meaning.",
        "Styling ordinary disabled or de-emphasized content; use the ordinary foreground hierarchy and disabled behavior instead."
      ]
    },
    {
      "id": "intent:brand",
      "status": "stable",
      "optional": false,
      "summary": "Product identity and the default accent for ordinary primary actions, links, selection, and optionally in-progress activity.",
      "useWhen": [
        "Expressing product identity, an ordinary primary action, a link, a default selected state, or a product-colored in-progress state."
      ],
      "avoidWhen": [
        "A semantic outcome, risk, failure, or specialized experience is the more important meaning."
      ],
      "precedence": [
        "Status and consequence outrank brand identity when both are present."
      ]
    },
    {
      "id": "intent:ai",
      "status": "stable",
      "optional": true,
      "summary": "Optional identity for in-product AI-generated, AI-assisted, or AI-entry experiences.",
      "useWhen": [
        "A product intentionally gives its AI-generated, AI-assisted, or AI-entry experience a distinct visual identity."
      ],
      "avoidWhen": [
        "Ordinary automation that is not presented as an AI experience.",
        "A success, caution, warning, or negative outcome is the meaning the user must understand first."
      ],
      "precedence": [
        "Status and consequence outrank AI provenance.",
        "Provide a non-color cue when identifying AI provenance matters."
      ]
    },
    {
      "id": "intent:negative",
      "status": "stable",
      "optional": false,
      "summary": "Errors, failures, invalid or broken states, destructive actions, and consequential unavailability.",
      "useWhen": [
        "Communicating an error, failure, invalid value, destructive action, expired state, disconnection, or broken condition."
      ],
      "avoidWhen": [
        "The situation only calls for attention, is still pending, or is unavailable without negative consequence."
      ]
    },
    {
      "id": "intent:warning",
      "status": "stable",
      "optional": false,
      "summary": "A rare, stronger risk distinction used only when caution is not enough to communicate the consequence.",
      "useWhen": [
        "A materially higher-risk condition must be distinguished from the system's normal attention state."
      ],
      "avoidWhen": [
        "The state is pending, ongoing, upcoming, merely needs attention, or is an ordinary urgent notice; default to caution.",
        "An error, failure, or destructive consequence has already occurred; use negative."
      ],
      "precedence": [
        "Default to caution and use warning only when the stronger distinction is genuinely necessary.",
        "Warning does not imply that action is always required."
      ]
    },
    {
      "id": "intent:caution",
      "status": "stable",
      "optional": false,
      "summary": "The default attention state for pending, ongoing, upcoming, urgent, or later-action conditions.",
      "useWhen": [
        "Something is happening, is pending, is urgent, or may need the user's attention now or later."
      ],
      "avoidWhen": [
        "A rare stronger-risk distinction is essential, or the state is already an error or failure."
      ],
      "precedence": [
        "Choose caution before warning unless the product has a meaningful need for both levels."
      ]
    },
    {
      "id": "intent:positive",
      "status": "stable",
      "optional": false,
      "summary": "Successful, complete, valid, healthy, improved, or favourable actions and outcomes.",
      "useWhen": [
        "Communicating success, completion, validity, health, improvement, or a favourable result."
      ],
      "avoidWhen": [
        "Styling the ordinary action that may lead to success; for example, Save remains brand until it has a positive outcome."
      ]
    },
    {
      "id": "intent:guide",
      "status": "stable",
      "optional": false,
      "summary": "Help, onboarding, and temporary guidance UI, including instructional tooltips, rings, and multi-step coaching.",
      "useWhen": [
        "Guiding a user through a feature, showing contextual help, or presenting an onboarding sequence."
      ],
      "avoidWhen": [
        "The UI is ordinary information, a permanent product accent, or Motive's reserved Walkthrough product experience."
      ]
    },
    {
      "id": "intent:walkthrough",
      "status": "stable",
      "optional": true,
      "summary": "Reserved optional intent for Motive's Walkthrough product experience.",
      "useWhen": [
        "Implementing Motive's explicitly defined Walkthrough product concept or a directly equivalent concept defined by another product."
      ],
      "avoidWhen": [
        "Implementing onboarding, coaching, tooltips, or ordinary guidance; use guide.",
        "The consumer has not explicitly defined an equivalent product concept."
      ]
    }
  ],
  "families": [
    {
      "id": "token-family:color.semantic-core",
      "kind": "token-family",
      "category": "color",
      "audience": "general",
      "status": "stable",
      "summary": "Mode-aware backgrounds, foregrounds, borders, and dividers for ordinary and semantic UI.",
      "tokenPatterns": [
        "--color-background-*",
        "--color-foreground-*",
        "--color-border-*",
        "--color-divider-*"
      ],
      "selectionRole": "direct",
      "useWhen": [
        "Choosing a surface and the content or boundaries that belong on it.",
        "Communicating one of the documented semantic intents."
      ],
      "avoidWhen": [
        "Drawing data visualizations, choosing a literal hue, or styling a specialized context with its own family."
      ],
      "constraints": [
        "Select the semantic intent before selecting a tone tier.",
        "Faint surfaces default to ordinary primary or secondary foregrounds; medium, bold, and strong surfaces use their matching on-background foregrounds.",
        "Use the primary foreground for primary content (titles, labels, values, main text) and secondary for supporting content (descriptions, helper text, metadata, placeholders).",
        "Restrict tertiary and quaternary foregrounds to inactive or disabled components and purely decorative content; never use them to quiet active information.",
        "Use tertiary borders for decorative structure, secondary borders as the default control boundary, and primary borders for a structural edge that needs more definition. An outline that alone identifies a small control, such as a checkbox, is a component-owned stroke in the tertiary foreground.",
        "Use background-primary for the page or card body and background-secondary for secondary surfaces and card chrome.",
        "Use dividers only for internal rules that separate content inside a surface; they are not a general component border.",
        "Medium intent borders are tinted edges below 3:1; use a bold or strong intent border when the stroke must identify a control or state.",
        "Do not infer a token from its current rendered hue."
      ],
      "recipes": [
        "token-recipe:foreground-hierarchy",
        "token-recipe:neutral-border-hierarchy",
        "token-recipe:semantic-color-pairing",
        "token-recipe:interaction-layers"
      ],
      "accessibility": [
        "Primary and secondary foregrounds clear 4.5:1 on their documented backgrounds; tertiary foregrounds clear 3:1 but are not normal-text defaults.",
        "Primary neutral borders and the tertiary foreground clear 3:1 on their documented surfaces; secondary and tertiary borders do not and cannot be the only thing identifying a control.",
        "Use documented foreground/background pairings and provide a non-color cue when meaning matters."
      ]
    },
    {
      "id": "token-family:color.interaction",
      "kind": "token-family",
      "category": "color",
      "audience": "general",
      "status": "stable",